{
  "$schema": "http://json-schema.org/2020-12/schema",
  "$ref": "#/definitions/Response",
  "definitions": {
	"Response": {
	  "type": "object",
	  "additionalProperties": false,
	  "properties": {
		"version": {
		  "type": "string"
		},
		"routeKey": {
		  "type": "string"
		},
		"rawPath": {
		  "type": "string"
		},
		"rawQueryString": {
		  "type": "string"
		},
		"headers": {
		  "$ref": "#/definitions/Headers"
		},
		"queryStringParameters": {
		  "$ref": "#/definitions/QueryStringParameters"
		},
		"requestContext": {
		  "$ref": "#/definitions/RequestContext"
		},
		"isBase64Encoded": {
		  "type": "boolean"
		}
	  },
	  "required": [
		"headers",
		"isBase64Encoded",
		"queryStringParameters",
		"rawPath",
		"rawQueryString",
		"requestContext",
		"routeKey",
		"version"
	  ],
	  "title": "Response"
	},
	"Headers": {
	  "type": "object",
	  "additionalProperties": false,
	  "properties": {
		"sec-fetch-mode": {
		  "type": "string"
		},
		"referer": {
		  "type": "string",
		  "format": "uri",
		  "qt-uri-protocols": [
			"https"
		  ]
		},
		"x-amzn-tls-version": {
		  "type": "string"
		},
		"sec-fetch-site": {
		  "type": "string"
		},
		"accept-language": {
		  "type": "string"
		},
		"x-forwarded-proto": {
		  "type": "string"
		},
		"x-forwarded-port": {
		  "type": "string",
		  "format": "integer"
		},
		"x-forwarded-for": {
		  "type": "string"
		},
		"sec-fetch-user": {
		  "type": "string"
		},
		"accept": {
		  "type": "string"
		},
		"x-amzn-tls-cipher-suite": {
		  "type": "string"
		},
		"sec-ch-ua": {
		  "type": "string"
		},
		"sec-ch-ua-mobile": {
		  "type": "string"
		},
		"x-amzn-trace-id": {
		  "type": "string"
		},
		"sec-ch-ua-platform": {
		  "type": "string"
		},
		"host": {
		  "type": "string"
		},
		"upgrade-insecure-requests": {
		  "type": "string",
		  "format": "integer"
		},
		"cache-control": {
		  "type": "string"
		},
		"accept-encoding": {
		  "type": "string"
		},
		"sec-fetch-dest": {
		  "type": "string"
		},
		"user-agent": {
		  "type": "string"
		}
	  },
	  "required": [
		"accept",
		"accept-encoding",
		"accept-language",
		"cache-control",
		"host",
		"referer",
		"sec-ch-ua",
		"sec-ch-ua-mobile",
		"sec-ch-ua-platform",
		"sec-fetch-dest",
		"sec-fetch-mode",
		"sec-fetch-site",
		"sec-fetch-user",
		"upgrade-insecure-requests",
		"user-agent",
		"x-amzn-tls-cipher-suite",
		"x-amzn-tls-version",
		"x-amzn-trace-id",
		"x-forwarded-for",
		"x-forwarded-port",
		"x-forwarded-proto"
	  ],
	  "title": "Headers"
	},
	"QueryStringParameters": {
	  "type": "object",
	  "additionalProperties": false,
	  "properties": {
		"code": {
		  "type": "string"
		},
		"state": {
		  "type": "string"
		}
	  },
	  "required": [
		"code",
		"state"
	  ],
	  "title": "QueryStringParameters"
	},
	"RequestContext": {
	  "type": "object",
	  "additionalProperties": false,
	  "properties": {
		"accountId": {
		  "type": "string"
		},
		"apiId": {
		  "type": "string"
		},
		"domainName": {
		  "type": "string"
		},
		"domainPrefix": {
		  "type": "string"
		},
		"http": {
		  "$ref": "#/definitions/HTTP"
		},
		"requestId": {
		  "type": "string",
		  "format": "uuid"
		},
		"routeKey": {
		  "type": "string"
		},
		"stage": {
		  "type": "string"
		},
		"time": {
		  "type": "string"
		},
		"timeEpoch": {
		  "type": "integer"
		}
	  },
	  "required": [
		"accountId",
		"apiId",
		"domainName",
		"domainPrefix",
		"http",
		"requestId",
		"routeKey",
		"stage",
		"time",
		"timeEpoch"
	  ],
	  "title": "RequestContext"
	},
	"HTTP": {
	  "type": "object",
	  "additionalProperties": false,
	  "properties": {
		"method": {
		  "type": "string"
		},
		"path": {
		  "type": "string"
		},
		"protocol": {
		  "type": "string"
		},
		"sourceIp": {
		  "type": "string"
		},
		"userAgent": {
		  "type": "string"
		}
	  },
	  "required": [
		"method",
		"path",
		"protocol",
		"sourceIp",
		"userAgent"
	  ],
	  "title": "HTTP"
	}
  }
}
